{"agentic_mapping": [{"canonical_function": "rota + visit scheduling (Birdie/Log my Care/Nourish)", "agentic_equivalent": "visits scheduled by need + geography + continuity (same carers); travel time costed", "notes": "Continuity of care is the quality metric — rota for familiar faces, not just coverage", "retained": true}, {"canonical_function": "visit notes + MAR sheets", "agentic_equivalent": "check-in/out with notes + meds administered logged per visit; gaps flagged same-day", "notes": "Missed meds are a safeguarding issue — MAR gaps escalate, never queue", "retained": true}, {"canonical_function": "CQC evidence pack", "agentic_equivalent": "safe/caring/responsive/effective/well-led evidence compiles from visit + training + incident nodes", "notes": "Same pattern as RCVS PSS pack and Arb Assoc evidence — inspection-ready always, not pre-inspection panic", "retained": true}, {"canonical_function": "DBS + Right to Work + training compliance (Care Certificate, moving & handling)", "agentic_equivalent": "carer cannot be rota'd past cert/DBS expiry — hard gate, shifts unassign automatically", "notes": "Same cert-gating as F-Gas/NPTC/EICR. One invariant, every vertical.", "retained": true}, {"canonical_function": "council vs private billing", "agentic_equivalent": "commissioned hours vs private invoices tracked separately from day one", "notes": "Same split discipline as funeral disbursements — different money, different rules", "retained": true}, {"canonical_function": "safeguarding alerts", "agentic_equivalent": "concern logged with photos/notes, manager + (where required) authority notified in policy time", "notes": "No discretion on thresholds — policy routes, humans judge", "retained": true}, {"canonical_function": "hospital discharge / reablement", "agentic_equivalent": "discharge notice creates ramp-up rota; outcomes tracked for commissioners", "notes": "Reablement wins council contracts — evidence it from the graph", "retained": true}], "canonical_stack": [{"category": "care management", "does": "Rota, visit notes, MAR, family portal", "tool": "Birdie", "verdict": "import-from"}, {"category": "care management (free tier)", "does": "Care planning + records at low entry cost", "tool": "Log my Care", "verdict": "import-from"}, {"category": "care management", "does": "Care planning depth, assessments", "tool": "Nourish", "verdict": "import-from"}, {"category": "care home ops", "does": "Residential setting companion where relevant", "tool": "CoolCare", "verdict": "import-from"}, {"category": "commissioning", "does": "Council call-monitoring + commissioned hours", "tool": "CM2000", "verdict": "integrate"}, {"category": "regulator", "does": "Ratings + inspection framework — evidence pack target", "tool": "CQC", "verdict": "integrate"}, {"category": "payroll", "does": "Hourly pay, mileage, holiday, pensions", "tool": "Payroll + Xero", "verdict": "integrate"}], "countries": ["GB"], "entry_question": "Council-commissioned, private-pay, or mixed — and domiciliary, live-in, or both?", "extra_dag_steps": [{"action": "data.import", "depends_on": ["email_verify"], "estimated_minutes": 15, "human_instructions": "Export service users, care plans, carer roster + certs; agent imports", "name": "Import users + plans + roster", "resource": "{company_id}/users", "step_id": "care_import", "step_type": "h_task"}, {"action": "compliance.configure", "depends_on": ["care_import"], "estimated_minutes": 15, "human_instructions": "Confirm DBS/Right-to-Work/training register + CQC evidence state", "name": "Set compliance register", "resource": "{company_id}/compliance", "step_id": "care_compliance", "step_type": "h_task"}, {"action": "funding.configure", "depends_on": ["care_compliance"], "estimated_minutes": 10, "human_instructions": "Set council contracts + private rates + mileage policy", "name": "Set funding + rates", "resource": "{company_id}/funding", "step_id": "care_funding", "step_type": "h_task"}], "graph_shape": {"edges": [{"description": "user receives plan", "from": "service_user", "relation": "has", "to": "care_plan"}, {"description": "plan generates visits", "from": "care_plan", "relation": "generates", "to": "visit"}, {"description": "carer does visit", "from": "carer", "relation": "does", "to": "visit"}, {"description": "visit administers meds", "from": "visit", "relation": "administers", "to": "mar_entry"}, {"description": "carer holds cert", "from": "carer", "relation": "holds", "to": "certificate"}, {"description": "visit funded by", "from": "visit", "relation": "funded_by", "to": "funding"}, {"description": "incident on visit", "from": "incident", "relation": "on", "to": "visit"}], "nodes": [{"description": "Person receiving care", "entity_type": "service_user", "fields": ["name", "address", "needs", "next_of_kin", "gp"]}, {"description": "Assessed care plan", "entity_type": "care_plan", "fields": ["user_id", "tasks", "visit_pattern", "review_due"]}, {"description": "One visit/call", "entity_type": "visit", "fields": ["user_id", "carer_id", "scheduled_at", "checked_in", "checked_out", "notes"]}, {"description": "Care worker + compliance", "entity_type": "carer", "fields": ["name", "dbs_expiry", "right_to_work", "cert_ids", "mileage_rate"]}, {"description": "Medication administration line", "entity_type": "mar_entry", "fields": ["visit_id", "medication", "dose", "given", "witness"]}, {"description": "Training/competency cert", "entity_type": "certificate", "fields": ["type", "holder_id", "issued_at", "expires_at"]}, {"description": "Council block vs private invoice", "entity_type": "funding", "fields": ["type", "rate_per_hour", "contract_id"]}, {"description": "Concern/safeguarding/fall", "entity_type": "incident", "fields": ["visit_id", "type", "notes", "escalated_at"]}]}, "import_sources": ["Care management export (Birdie/Nourish/Log my Care)", "Carer roster + cert files", "Council contract schedules"], "template_id": "tpl-care-gb", "vertical": "care", "workflows": [{"name": "referral → assess → plan → rota → visit → bill", "steps": ["referral assessed", "care plan written + review dated", "rota built for continuity", "visits with check-in/out + notes + MAR", "council/private billed separately"], "trigger": "new referral"}, {"name": "MAR gap guard", "steps": ["meds due per plan", "gap detected same-day", "manager alerted, cover arranged"], "trigger": "missed administration"}, {"name": "safeguarding route", "steps": ["concern logged immediately", "policy-time escalation", "authority notified where required", "record sealed + auditable"], "trigger": "concern raised"}]}