{"agentic_mapping": [{"canonical_function": "recurring scheduling (weekly/fortnightly/3-weekly)", "agentic_equivalent": "recurring_plan node with explicit cadence incl. non-weekly patterns incumbents handle poorly", "notes": "Verified 2026: fortnightly/3-weekly/4-weekly + skip-this-week are the gap — model them first-class, not as workarounds", "retained": true}, {"canonical_function": "card-at-booking + auto-charge (BookingKoala/ConvertLabs)", "agentic_equivalent": "card captured at booking, auto-charged on visit completion inside policy", "notes": "Hands-off recurring payment is the retention engine — never invoice-led where avoidable", "retained": true}, {"canonical_function": "cleaner safety check-ins (ZenMaid SOS)", "agentic_equivalent": "lone-worker timers per visit; missed check-in escalates to manager", "notes": "Safety is non-negotiable in domestic cleaning — keep it, make it automatic", "retained": true}, {"canonical_function": "key + alarm management (Cleenie)", "agentic_equivalent": "property node holds access method; agent surfaces keys/alarms/parking per visit", "notes": "Access friction kills schedules — put it where the cleaner looks", "retained": true}, {"canonical_function": "review requests post-clean", "agentic_equivalent": "agent asks within 2h of completion, suppresses after complaints", "notes": "Referral-heavy trade: review timing is the highest-ROI automation", "retained": true}, {"canonical_function": "churn recovery (paused/cancelled clients)", "agentic_equivalent": "paused plans trigger multi-touch win-back from visit history", "notes": "5-10 recovered clients/mo is typical — model pause as a state, not a deletion", "retained": true}], "canonical_stack": [{"category": "cleaning ops (maid-specific)", "does": "Recurring schedules, cleaner dispatch, SOS safety, payroll; per-seat pricing punishes scale", "tool": "ZenMaid", "verdict": "import-from"}, {"category": "cleaning ops (card-first)", "does": "No-per-user tiers, card capture + auto-charge, website themes included", "tool": "BookingKoala", "verdict": "import-from"}, {"category": "cleaning ops (all-in-one)", "does": "Website + booking + payments + community, no per-user fee", "tool": "ConvertLabs", "verdict": "import-from"}, {"category": "cleaning ops (booking engine)", "does": "Conversion-optimized booking with instant pricing; dated but functional; ~$99-125/mo", "tool": "Launch27", "verdict": "import-from"}, {"category": "cleaning ops (UK-built)", "does": "Scheduling + VAT invoicing + team rotas + key tracking; £12-28/mo, unlimited team — best UK value", "tool": "Cleenie", "verdict": "import-from"}, {"category": "cleaning ops (UK flat-rate)", "does": "Scheduling, HR, payroll, invoicing; flat tiers beat per-user at 20+ staff", "tool": "ProCleanerUK", "verdict": "import-from"}, {"category": "field service (generalist)", "does": "Strong scheduling + client hub; CAVEAT: per-user pricing hits £300-600/mo at 20 staff — calculate at projected size", "tool": "Jobber", "verdict": "import-from"}, {"category": "commercial janitorial", "does": "Purpose-built for contract/commercial cleaning ops", "tool": "Swept", "verdict": "import-from"}], "countries": ["GB"], "entry_question": "Domestic recurring, commercial contracts, or both — and how many cleaners at maturity (pricing scales with heads)?", "extra_dag_steps": [{"action": "data.import", "depends_on": ["email_verify"], "estimated_minutes": 10, "human_instructions": "Export clients + recurring schedules, agent imports to plans", "name": "Import clients + schedules", "resource": "{company_id}/clients", "step_id": "cleaning_import", "step_type": "h_task"}, {"action": "payments.connect", "depends_on": ["cleaning_import"], "estimated_minutes": 5, "human_instructions": "One Stripe OAuth click for card-on-file + auto-charge", "name": "Connect card payments", "resource": "{company_id}/payments", "step_id": "cleaning_payments", "step_type": "h_task"}, {"action": "rota.configure", "depends_on": ["cleaning_payments"], "estimated_minutes": 10, "human_instructions": "Confirm team roster, areas, cadences incl. non-weekly patterns", "name": "Set team + rota patterns", "resource": "{company_id}/rota", "step_id": "cleaning_rota", "step_type": "h_task"}], "graph_shape": {"edges": [{"description": "client owns property", "from": "client", "relation": "owns", "to": "property"}, {"description": "plan covers property", "from": "recurring_plan", "relation": "covers", "to": "property"}, {"description": "plan generates visits", "from": "recurring_plan", "relation": "generates", "to": "visit"}, {"description": "cleaner assigned", "from": "cleaner", "relation": "assigned", "to": "visit"}, {"description": "visit follows checklist", "from": "visit", "relation": "follows", "to": "checklist"}, {"description": "visit billed", "from": "visit", "relation": "billed_by", "to": "invoice"}, {"description": "client reviews cleaner", "from": "client", "relation": "reviews", "to": "cleaner"}], "nodes": [{"description": "Household or site contact", "entity_type": "client", "fields": ["name", "phone", "email", "billing"]}, {"description": "Premises with access details", "entity_type": "property", "fields": ["address", "keys", "alarm", "parking", "pets"]}, {"description": "Recurring agreement incl. odd cadences", "entity_type": "recurring_plan", "fields": ["property_id", "cadence", "status", "price_per_visit"]}, {"description": "One clean", "entity_type": "visit", "fields": ["plan_id", "cleaner_id", "scheduled_at", "status", "photos", "checked_in"]}, {"description": "Cleaner / team member", "entity_type": "cleaner", "fields": ["name", "areas", "rating", "safety_contact"]}, {"description": "Per-visit task list", "entity_type": "checklist", "fields": ["plan_id", "items"]}, {"description": "Bill (auto-charged where possible)", "entity_type": "invoice", "fields": ["visit_id", "total", "vat", "auto_charged"]}]}, "import_sources": ["ZenMaid/Jobber client + schedule export", "Cleenie/ProCleanerUK export", "Spreadsheet rotas"], "template_id": "tpl-cleaning-gb", "vertical": "cleaning", "workflows": [{"name": "book → clean → photo → charge → review", "steps": ["booking with card capture", "cleaner assigned with keys/alarms surfaced", "check-in + safety timer starts", "photos on completion", "auto-charge", "review ask within 2h"], "trigger": "new booking or plan visit due"}, {"name": "pause → win-back", "steps": ["plan paused (never deleted)", "multi-touch win-back from history", "rebook on reply", "track recovery rate"], "trigger": "client pauses or cancels"}, {"name": "rota fill", "steps": ["detect gaps from holidays/sickness", "offer shifts to available cleaners", "client notified of stand-in with intro"], "trigger": "cleaner unavailable"}]}