{"agentic_mapping": [{"canonical_function": "fee math per platform (sellerfeecalc/ResaleOS)", "agentic_equivalent": "net computed per platform BEFORE listing from live fee schedules; route each item to highest-net channel", "notes": "Verified 2026: eBay 9.9-14.9% + £0.30/0.40 + 0.35-0.42% regulatory; Etsy £0.15 + 6.5% + 4%+£0.20; Depop 0% + processing; Vinted 0% seller-side; Amazon 7-15% + £0.75/£25mo. Lowest fee != highest net — sell-through matters", "retained": true}, {"canonical_function": "crosslisting (Vendoo/Crosslist/List Perfectly/ResaleOS)", "agentic_equivalent": "one item → N listings; sale anywhere auto-delists everywhere", "notes": "Demand is uneven across platforms; manual multi-channel = labour tax. Delist discipline is the whole game", "retained": true}, {"canonical_function": "sourcing ROI per channel", "agentic_equivalent": "every buy logged with source type; ROI + days-to-sell per channel accumulates", "notes": "Kill bad sources with data: charity-shop electronics vs retail-arbitrage toys behave differently", "retained": true}, {"canonical_function": "inventory aging + dead stock", "agentic_equivalent": "days-held tracked per item; reprice/donate/bundle triggers at thresholds", "notes": "Buy-hold-X-days-sell only works if X is enforced — shelf rent is real even at home", "retained": true}, {"canonical_function": "photography + measurements + condition grading", "agentic_equivalent": "listing pack compiled per platform spec from one shoot (Vinted wants lifestyle, eBay wants measurements)", "notes": "Shoot once, publish everywhere — platform specs differ, source assets don't", "retained": true}, {"canonical_function": "shipping labels (Royal Mail/Evri/DPD/Parcel2Go)", "agentic_equivalent": "cheapest compliant label per parcel size; tracking auto-attached to sale", "notes": "Shipping profit/loss tracked per sale — undercharging postage is the silent killer", "retained": true}], "canonical_stack": [{"category": "marketplace (volume)", "does": "Collectibles/electronics/niche; 9.9-14.9% + per-order fee; private sellers 0% on personal items (UK)", "tool": "eBay", "verdict": "integrate"}, {"category": "marketplace (fashion, zero seller fee)", "does": "0% seller-side, buyer pays protection fee — best payout on fashion; volume is the constraint", "tool": "Vinted", "verdict": "integrate"}, {"category": "marketplace (streetwear/vintage)", "does": "0% seller fee + processing; 12% boost on promoted sales", "tool": "Depop", "verdict": "integrate"}, {"category": "marketplace (handmade/vintage 20yr+)", "does": "£0.15 listing + 6.5% + processing; curated-buyer audience for vintage flips", "tool": "Etsy", "verdict": "integrate"}, {"category": "marketplace (velocity)", "does": "7-15% referral + sub; FBA from ~£2.83 — for wholesale/new-goods types only", "tool": "Amazon UK", "verdict": "integrate"}, {"category": "crosslisting", "does": "List once, publish everywhere, auto-delist on sale", "tool": "Vendoo / Crosslist / List Perfectly / ResaleOS", "verdict": "integrate"}, {"category": "shipping", "does": "Labels, drop-offs, tracking", "tool": "Royal Mail Click & Drop / Evri / DPD / Parcel2Go", "verdict": "integrate"}, {"category": "fee intelligence", "does": "Verified fee schedules with dates — never trust undated fee numbers", "tool": "sellerfeecalc / ResaleOS index", "verdict": "integrate"}], "countries": ["GB"], "entry_question": "Which sourcing type — thrift (charity/car-boot), retail arbitrage, wholesale, trade-ins, or vintage/handmade?", "extra_dag_steps": [{"action": "channels.configure", "depends_on": ["email_verify"], "estimated_minutes": 15, "human_instructions": "Connect marketplace accounts (eBay, Vinted, Depop, Etsy as relevant) + causes crosslister access", "name": "Connect marketplaces + crosslister", "resource": "{company_id}/channels", "step_id": "reseller_channels", "step_type": "h_task"}, {"action": "fees.configure", "depends_on": ["reseller_channels"], "estimated_minutes": 10, "human_instructions": "Confirm fee schedules per platform + postage defaults + return policy", "name": "Set fee + postage defaults", "resource": "{company_id}/policy/fees", "step_id": "reseller_fees", "step_type": "h_task"}, {"action": "source.log", "depends_on": ["reseller_fees"], "estimated_minutes": 5, "human_instructions": "Log first sourcing run (where, what, paid) to seed ROI tracking", "name": "Log first sourcing run", "resource": "{company_id}/sources", "step_id": "reseller_first_run", "step_type": "m_task"}], "graph_shape": {"edges": [{"description": "item sourced from channel", "from": "inventory_item", "relation": "sourced_from", "to": "source"}, {"description": "listing sells item", "from": "listing", "relation": "of", "to": "inventory_item"}, {"description": "listing lives on platform", "from": "listing", "relation": "on", "to": "platform"}, {"description": "sale closes listing", "from": "sale", "relation": "closes", "to": "listing"}, {"description": "sale ships via parcel", "from": "sale", "relation": "ships_via", "to": "shipment"}, {"description": "sale to buyer", "from": "sale", "relation": "to", "to": "buyer"}], "nodes": [{"description": "Where stock comes from (the TYPE axis)", "entity_type": "source", "fields": ["source_type", "name", "location", "avg_roi", "avg_days_to_sell"]}, {"description": "One unit of stock with economics", "entity_type": "inventory_item", "fields": ["name", "condition", "buy_price", "list_price", "days_held", "photos", "measurements", "status"]}, {"description": "Item live on one platform", "entity_type": "listing", "fields": ["item_id", "platform", "price", "net_estimate", "status", "listed_at"]}, {"description": "Marketplace with fee schedule", "entity_type": "platform", "fields": ["name", "fee_pct", "fixed_fee", "listing_fee", "verified_date"]}, {"description": "Completed sale with true net", "entity_type": "sale", "fields": ["listing_id", "sold_price", "fees", "postage_cost", "net", "roi_pct"]}, {"description": "Parcel + tracking", "entity_type": "shipment", "fields": ["sale_id", "carrier", "tracking", "cost"]}, {"description": "Buyer (for repeats/claims)", "entity_type": "buyer", "fields": ["platform", "handle", "history"]}]}, "import_sources": ["eBay active listings export", "Spreadsheet stock lists", "Photo library"], "template_id": "tpl-reseller-gb", "vertical": "reseller", "workflows": [{"name": "source → shoot → list → crosslist → sell → delist → ship", "steps": ["sourcing run logged with costs", "one shoot: photos + measurements + condition grade", "net computed per platform, routed to best", "crosslisted, delist-on-sale armed", "sale closes + delists everywhere", "label printed, tracking attached", "ROI posted back to source channel"], "trigger": "new stock acquired"}, {"name": "aging guard", "steps": ["days-held scanned weekly", "stale items repriced per rules", "dead stock bundled/donated", "shelf space freed"], "trigger": "weekly aging scan"}, {"name": "fee-arbitrage reroute", "steps": ["fee schedules re-verified (dated)", "listings re-routed to highest-net platform", "price adjusted for fee deltas"], "trigger": "fee change detected or quarterly"}]}