{"agentic_mapping": [{"canonical_function": "first call (often out-of-hours)", "agentic_equivalent": "agent logs the call with structure (deceased, location, informant, wishes known), pages on-call director", "notes": "First call is the whole business won or lost — answer always, structure everything", "retained": true}, {"canonical_function": "transfer/removal with custody tracking", "agentic_equivalent": "custody chain as nodes with QR scans; offline-capable mobile updates", "notes": "Chain of custody is the compliance spine — every handoff scanned, nothing on memory", "retained": true}, {"canonical_function": "arrangement meeting", "agentic_equivalent": "agent prepares the arrangement pack (options, prices, availability) — director leads, machine remembers", "notes": "Human leads (grief is not automatable); machine ensures nothing is forgotten or double-entered", "retained": true}, {"canonical_function": "service scheduling (church/crematorium/celebrant/vehicles/staff)", "agentic_equivalent": "multi-party scheduling with double-booking guards", "notes": "Same constraint solve as bays/chairs, with far higher stakes", "retained": true}, {"canonical_function": "disbursements vs professional fees", "agentic_equivalent": "third-party costs tracked separately from own fees from the first entry", "notes": "Disbursement confusion is the #1 billing dispute — separate at capture, not at invoice", "retained": true}, {"canonical_function": "family portal + comms", "agentic_equivalent": "family sees arrangement progress, documents, times — agent answers logistics questions", "notes": "Tone is everything: logistics by agent, grief by humans. Boundary explicit.", "retained": true}, {"canonical_function": "CMA Order 2021 duties (price lists, inducement ban)", "agentic_equivalent": "Standardised + Attended/Unattended Price Lists published and current; ownership disclosed; zero hospital/hospice/care-home/coroner referral arrangements, evidenced", "notes": "Hard law NOW (Enterprise Act Order). No licensing regime exists yet in England/Wales (recommended only) — never claim regulated status.", "retained": true}, {"canonical_function": "aftercare + pre-need", "agentic_equivalent": "bereavement follow-up scheduled; pre-need plans as nodes converting in time", "notes": "Aftercare is care AND the pre-need pipeline — model both", "retained": true}], "canonical_stack": [{"category": "funeral home management", "does": "First-call → case → custody → scheduling → contracts → finance → family portal; Funeral Director Portal; UK G-Cloud listed", "tool": "PlotBox", "verdict": "integrate"}, {"category": "current state (many independents)", "does": "Whiteboards, cremation logs, email threads — the single-source-of-truth gap IS the opportunity", "tool": "Manual / paper", "verdict": "import-from"}, {"category": "accounting", "does": "Disbursement-heavy invoicing, VAT", "tool": "Xero / Sage", "verdict": "integrate"}, {"category": "existing data", "does": "Case files, price lists, venue contacts, celebrant roster", "tool": "PlotBox / paper export", "verdict": "import-from"}], "countries": ["GB"], "entry_question": "Independent funeral home on PlotBox/paper, or cemetery-crematorium group needing the full PlotBox-style operation?", "extra_dag_steps": [{"action": "data.import", "depends_on": ["email_verify"], "estimated_minutes": 15, "human_instructions": "Export/import case files, price lists, venue + celebrant contacts", "name": "Import cases + prices + contacts", "resource": "{company_id}/cases", "step_id": "funeral_import", "step_type": "h_task"}, {"action": "rota.configure", "depends_on": ["phone_purchase"], "estimated_minutes": 10, "human_instructions": "Set on-call rota for first calls + transfer team", "name": "Set on-call rota", "resource": "{company_id}/rota", "step_id": "funeral_rota", "step_type": "h_task"}, {"action": "tone.configure", "depends_on": ["funeral_import"], "estimated_minutes": 10, "human_instructions": "Director approves agent comms boundaries: logistics yes, grief no", "name": "Set comms boundary", "resource": "{company_id}/policy/comms", "step_id": "funeral_tone", "step_type": "h_task"}], "graph_shape": {"edges": [{"description": "family instructs funeral home", "from": "family", "relation": "instructs", "to": "case"}, {"description": "case concerns deceased", "from": "case", "relation": "concerns", "to": "deceased"}, {"description": "custody event on case", "from": "custody_event", "relation": "on", "to": "case"}, {"description": "service fulfils case", "from": "service", "relation": "fulfils", "to": "case"}, {"description": "service at venue", "from": "service", "relation": "at", "to": "venue"}, {"description": "disbursement on case", "from": "disbursement", "relation": "on", "to": "case"}, {"description": "case billed", "from": "case", "relation": "billed_by", "to": "invoice"}, {"description": "pre-need converts to case", "from": "pre_need_plan", "relation": "converts_to", "to": "case"}], "nodes": [{"description": "Bereaved family (extreme-sensitivity handling)", "entity_type": "family", "fields": ["contact_name", "phone", "email", "wishes_known", "sensitivity_notes"]}, {"description": "Deceased person", "entity_type": "deceased", "fields": ["name", "date_of_death", "location", "coroner_involved"]}, {"description": "Arrangement case (the unit of work)", "entity_type": "case", "fields": ["family_id", "type", "status", "director_id"]}, {"description": "Custody handoff (QR-scanned)", "entity_type": "custody_event", "fields": ["case_id", "from", "to", "scanned_at", "offline"]}, {"description": "Funeral service event", "entity_type": "service", "fields": ["case_id", "venue_id", "starts_at", "celebrant", "vehicles", "staff"]}, {"description": "Church/crematorium/cemetery slot", "entity_type": "venue", "fields": ["name", "type", "capacity", "fee"]}, {"description": "Third-party cost (crematorium, doctors, flowers)", "entity_type": "disbursement", "fields": ["case_id", "payee", "amount", "paid"]}, {"description": "Bill: fees + disbursements separated", "entity_type": "invoice", "fields": ["case_id", "professional_fees", "disbursements", "total"]}, {"description": "Pre-paid plan", "entity_type": "pre_need_plan", "fields": ["holder", "value", "status"]}]}, "import_sources": ["PlotBox case export", "Price lists", "Venue/celebrant contacts", "Paper files (digitise)"], "template_id": "tpl-funeral-gb", "vertical": "funeral", "workflows": [{"name": "first call → transfer → arrangement → service → bill → aftercare", "steps": ["first call answered + structured (any hour)", "transfer with custody scan", "arrangement meeting (director-led, agent-prepared pack)", "service scheduled across venue/celebrant/vehicles/staff", "disbursements tracked separately throughout", "invoice: fees + disbursements", "aftercare follow-up scheduled"], "trigger": "death reported"}, {"name": "custody guard", "steps": ["every handoff QR-scanned", "offline scans sync on reconnect", "missing scan blocks next step", "audit trail compiles instantly"], "trigger": "any transfer"}, {"name": "disbursement guard", "steps": ["third-party cost captured at source", "never mixed with professional fees", "client sees split from day one"], "trigger": "any external cost"}]}