{"agentic_mapping": [{"canonical_function": "multi-app earnings rollup (Gridwise (150k+ monthly drivers, LinkedIn 2026)", "agentic_equivalent": "every trip logged with platform tag; £/mile + £/hour per platform computed live", "notes": "The platforms ARE the market — the driver has no customers, only channels. Compare them like the restaurant compares Deliveroo vs direct", "retained": true}, {"canonical_function": "accept/decline decisions", "agentic_equivalent": "per-trip floor (£/mile incl. dead miles); below floor = decline logged with reason", "notes": "Dead miles wear the car unpaid — floor must include pickup distance, not just trip distance", "retained": true}, {"canonical_function": "mileage capture incl. idle miles (Gridwise/MileClear)", "agentic_equivalent": "all miles auto-logged; HMRC AMAP applied per trip date (55p/mile to 10k from Apr 2026, then 25p)", "notes": "Verified 2026: most logs miss pickup-to-dropoff gaps. Idle miles are deductible wear.", "retained": true}, {"canonical_function": "quest/bonus/incentive tracking", "agentic_equivalent": "active promos as nodes; progress tracked; shift planned around completion thresholds", "notes": "Quests change the £/hour math mid-shift — model them, don't remember them", "retained": true}, {"canonical_function": "expense + receipt capture (fuel, wash, tolls, congestion)", "agentic_equivalent": "receipts scanned to HMRC expense types; congestion/parking auto-flagged by zone", "notes": "London congestion + ULEZ + parking are material — zone-aware flagging", "retained": true}, {"canonical_function": "tax set-aside + Self Assessment (SA103S)", "agentic_equivalent": "weekly % swept to tax pot from net; return pre-filled from trip+expense ledger", "notes": "Gig workers fail on tax surprise, not tax rate — set-aside weekly, file from the ledger", "retained": true}, {"canonical_function": "peak-hour / zone targeting", "agentic_equivalent": "golden hours + heatmaps from own history; plan shifts on proven windows", "notes": "20%+ hourly uplift from driving proven windows vs random hours", "retained": true}], "canonical_stack": [{"category": "ridehail", "does": "Rides; toggle Eats in same driver app during slow periods", "tool": "Uber (+ Eats toggle) / Bolt", "verdict": "integrate"}, {"category": "food delivery", "does": "Batch orders, platform promos", "tool": "Deliveroo / Just Eat / Uber Eats", "verdict": "integrate"}, {"category": "parcel / flex", "does": "Block bookings, depot runs", "tool": "Amazon Flex / Stuart / Gophr", "verdict": "integrate"}, {"category": "earnings OS (1M+ drivers)", "does": "Multi-platform rollup, effective-hourly, peak/zone data, idle-mile capture", "tool": "Gridwise", "verdict": "import-from"}, {"category": "pay prediction + filing (US-leaning)", "does": "AI pay predictions, guaranteed pay, in-app tax filing", "tool": "Solo", "verdict": "import-from"}, {"category": "mileage + tax (UK-built)", "does": "HMRC AMAP auto-applied, platform tags, shift grades, SA103 wizard; free unlimited tracking", "tool": "MileClear", "verdict": "import-from"}, {"category": "driver tax (UK)", "does": "8-platform imports, SA103+SA100 pre-fill, £7.99/mo", "tool": "MoneyMiles", "verdict": "import-from"}, {"category": "compliance", "does": "PCO licence (London), hire-and-reward insurance, MOT/service, DBS", "tool": "TfL / insurer", "verdict": "integrate"}], "countries": ["GB"], "entry_question": "Which platforms (ridehail, food, parcels) and is the vehicle owned, financed, or rented (PCO)?", "extra_dag_steps": [{"action": "platforms.connect", "depends_on": ["email_verify"], "estimated_minutes": 10, "human_instructions": "Connect driver apps for earnings import (or authorise CSV pulls)", "name": "Connect gig platforms", "resource": "{company_id}/platforms", "step_id": "gig_platforms", "step_type": "h_task"}, {"action": "vehicle.configure", "depends_on": ["gig_platforms"], "estimated_minutes": 5, "human_instructions": "Confirm vehicle (mpg/fuel or EV rate, insurance, PCO/MOT dates)", "name": "Set vehicle + costs", "resource": "{company_id}/vehicle", "step_id": "gig_vehicle", "step_type": "h_task"}, {"action": "floor.configure", "depends_on": ["gig_vehicle"], "estimated_minutes": 5, "human_instructions": "Agree £/mile floor + weekly tax set-aside %", "name": "Set accept floor + tax %", "resource": "{company_id}/policy/floor", "step_id": "gig_floor", "step_type": "h_task"}], "graph_shape": {"edges": [{"description": "trip on platform", "from": "trip", "relation": "on", "to": "platform"}, {"description": "trip in shift", "from": "trip", "relation": "in", "to": "shift"}, {"description": "expense in shift", "from": "expense", "relation": "in", "to": "shift"}, {"description": "payout for shift", "from": "payout", "relation": "for", "to": "shift"}, {"description": "trip uses vehicle", "from": "trip", "relation": "uses", "to": "vehicle"}, {"description": "quest completed in shift", "from": "quest", "relation": "completed_in", "to": "shift"}], "nodes": [{"description": "One working session", "entity_type": "shift", "fields": ["started_at", "ended_at", "miles", "gross", "net", "grade"]}, {"description": "Single trip/delivery/block", "entity_type": "trip", "fields": ["platform", "pickup_miles", "trip_miles", "payout", "accepted", "decline_reason"]}, {"description": "Gig platform with terms", "entity_type": "platform", "fields": ["name", "pay_model", "effective_per_mile", "effective_per_hour"]}, {"description": "Weekly platform payout", "entity_type": "payout", "fields": ["platform", "period", "gross", "adjustments"]}, {"description": "Deductible cost", "entity_type": "expense", "fields": ["type", "amount", "receipt", "hmrc_category"]}, {"description": "Vehicle + running costs", "entity_type": "vehicle", "fields": ["type", "fuel_per_mile", "insurance_mo", "pco_expiry", "mot_due"]}, {"description": "Promo/quest/incentive", "entity_type": "quest", "fields": ["platform", "target", "progress", "bonus", "expires"]}]}, "import_sources": ["Platform earnings CSVs (Uber/Deliveroo/Just Eat/Flex/Stuart)", "Bank Open Banking feed", "Mileage app export"], "template_id": "tpl-gig-driver-gb", "vertical": "gig_driver", "workflows": [{"name": "go online → accept/decline → shift P&L", "steps": ["platforms + quests checked", "each offer vs £/mile floor (incl. dead miles)", "declines logged with reason", "shift closed with grade + net", "tax % swept to pot"], "trigger": "shift start"}, {"name": "quest chase", "steps": ["active quests with progress", "shift routed to complete highest-value quest", "abandon threshold if math breaks"], "trigger": "quest available"}, {"name": "weekly money", "steps": ["payouts reconciled vs trips", "expenses + mileage totalled", "tax pot topped", "SA figures accumulate"], "trigger": "week end"}]}