{"agentic_mapping": [{"canonical_function": "receipt → ledger pipeline (Dext/AutoEntry)", "agentic_equivalent": "capture → extract → publish to ledger with match confidence; low-confidence items become exceptions, not guesses", "notes": "Drop campaign tie-in: LedgerLine £29/mo attach, exception-clear rate ≥80% unaided or fix models first", "retained": true}, {"canonical_function": "weekly reconciliation + exception clearing", "agentic_equivalent": "agent matches, categorizes, drafts chases; human approves sends", "notes": "The gap between shoebox (£0, chaos) and accountant (£150+/mo cleanup) IS the product", "retained": true}, {"canonical_function": "MTD checkpoint tracking (Senta/IRIS)", "agentic_equivalent": "mandate status + quarterly deadlines per client tracked; chasing automated, filing in recognised tools", "notes": "Verified 2026: MTD ITSA Apr 2026 £50k+, 2027 £30k+, 2028 £20k+ — hundreds of quarterly checkpoints per practice. Practice tools track; filing tools file. Never confuse the two.", "retained": true}, {"canonical_function": "overdue-chase drafts", "agentic_equivalent": "chase drafts generated, human approves every send", "notes": "Money-adjacent comms stay human-approved at any autonomy level", "retained": true}, {"canonical_function": "payroll + year-end + confirmation statements", "agentic_equivalent": "deadline-driven job list per client with owners; agent prepares, human signs", "notes": "Same prepare/decide split as tradie quotes and vet prescriptions", "retained": true}, {"canonical_function": "AML supervision (MLR 2017)", "agentic_equivalent": "practice registers with HMRC or professional-body supervisor (ICB/AAT/ACCA) before taking clients; exemptions checked (<£30k + <5% + supervised review)", "notes": "Unsupervised practice is a criminal offence — the first compliance gate, before any client work.", "retained": true}, {"canonical_function": "accountant export / handover", "agentic_equivalent": "clean trial balance + document pack exported in accountant's format", "notes": "Be the referrer's favourite client source: clean books in, zero cleanup", "retained": true}], "canonical_stack": [{"category": "ledger (client books live here)", "does": "Record what you enter — UI, not done-books; MTD-recognised filing", "tool": "Xero / QuickBooks / FreeAgent", "verdict": "integrate"}, {"category": "receipt capture", "does": "Invoice/receipt/statement extraction → publish to ledger", "tool": "Dext", "verdict": "integrate"}, {"category": "receipt capture + MTD prep", "does": "Sage-owned; AccountsPrep builds digital records for non-cloud clients", "tool": "AutoEntry", "verdict": "integrate"}, {"category": "practice management (#1 ranked)", "does": "Workflow + email triage + time/budgets; modern UX", "tool": "Karbon", "verdict": "import-from"}, {"category": "practice management (UK-built)", "does": "CRM + workflows + deadline tracking + AML + portal + unlimited e-sign; £27-32/user/mo; now IRIS Elements", "tool": "Senta", "verdict": "import-from"}, {"category": "practice management (UK peer)", "does": "Closest UK-built peer, popular with soles/small bookkeeping firms", "tool": "AccountancyManager", "verdict": "import-from"}, {"category": "filing (MTD-recognised)", "does": "SA + CT filing, VAT filer, accounts production iXBRL", "tool": "IRIS Elements Tax / Accounts", "verdict": "integrate"}, {"category": "pricing + proposals", "does": "Engagement letters, fixed-fee proposals, e-signed onboarding", "tool": "GoProposal", "verdict": "integrate"}], "countries": ["GB"], "entry_question": "Done-books service (LedgerLine-shaped, monthly) or full practice with accounts + tax filing?", "extra_dag_steps": [{"action": "data.connect", "depends_on": ["email_verify"], "estimated_minutes": 15, "human_instructions": "Connect client ledgers (Xero/QBO/FreeAgent) read access + receipt capture", "name": "Connect ledgers + capture", "resource": "{company_id}/ledgers", "step_id": "books_connect", "step_type": "h_task"}, {"action": "mandates.configure", "depends_on": ["books_connect"], "estimated_minutes": 10, "human_instructions": "Confirm MTD mandates per client (VAT/ITSA thresholds) + deadlines", "name": "Set MTD mandate map", "resource": "{company_id}/mandates", "step_id": "books_mandates", "step_type": "h_task"}, {"action": "retainer.configure", "depends_on": ["books_mandates"], "estimated_minutes": 10, "human_instructions": "Set packages (£29 attach / £49 standalone pattern) + chase-approval rules", "name": "Set retainer packages", "resource": "{company_id}/packages", "step_id": "books_packages", "step_type": "h_task"}], "graph_shape": {"edges": [{"description": "client on retainer", "from": "client", "relation": "on", "to": "engagement"}, {"description": "engagement covers period", "from": "engagement", "relation": "covers", "to": "books_period"}, {"description": "receipt feeds period", "from": "receipt", "relation": "feeds", "to": "books_period"}, {"description": "exception blocks period", "from": "exception", "relation": "blocks", "to": "books_period"}, {"description": "chase resolves exception", "from": "chase", "relation": "resolves", "to": "exception"}, {"description": "filing closes period", "from": "filing", "relation": "closes", "to": "books_period"}, {"description": "period billed", "from": "books_period", "relation": "billed_by", "to": "invoice"}], "nodes": [{"description": "Sole trader / landlord / small ltd", "entity_type": "client", "fields": ["name", "entity_type", "turnover_band", "mtd_mandates"]}, {"description": "Monthly/quarterly service agreement", "entity_type": "engagement", "fields": ["client_id", "package", "fee_mo", "scope"]}, {"description": "One closable period (month/quarter)", "entity_type": "books_period", "fields": ["client_id", "period", "status", "exception_count"]}, {"description": "Captured doc awaiting match", "entity_type": "receipt", "fields": ["period_id", "image", "extracted", "match_confidence"]}, {"description": "Unmatched/unclear item needing resolution", "entity_type": "exception", "fields": ["period_id", "description", "owner", "status"]}, {"description": "Human-approved nudge", "entity_type": "chase", "fields": ["exception_id", "draft", "approved", "sent_at"]}, {"description": "VAT return / ITSA quarter / accounts / confirmation statement", "entity_type": "filing", "fields": ["client_id", "type", "due", "status", "filed_in"]}, {"description": "Own monthly fee", "entity_type": "invoice", "fields": ["client_id", "period", "total", "status"]}]}, "import_sources": ["Client list + prior-year trial balances", "Receipt backlogs (shoebox digitise)", "Accountant referral pipeline"], "template_id": "tpl-bookkeeping-gb", "vertical": "bookkeeping", "workflows": [{"name": "onboard → connect → weekly reconcile → quarterly file", "steps": ["ledger + capture connected", "mandate map set", "weekly: receipts matched, exceptions raised, chases drafted", "human approves sends", "quarter closes, MTD filed in recognised tool", "accountant export on demand"], "trigger": "new client"}, {"name": "exception clear", "steps": ["unmatched item raised with confidence", "agent proposes category from history", "client confirms or corrects", "clear-rate tracked (kill <80% unaided)"], "trigger": "receipt published without match"}, {"name": "MTD quarter run", "steps": ["all periods closed", "filings generated per mandate", "human signs", "submitted + receipted"], "trigger": "quarter end"}]}