{"agentic_mapping": [{"canonical_function": "PPM rounds + asset service history (Commusoft/Joblogic)", "agentic_equivalent": "agent auto-schedules PPM visits per contract, pulls asset history for the engineer", "notes": "Recurring revenue engine — PPM nodes with auto-renewing schedules", "retained": true}, {"canonical_function": "F-Gas refrigerant tracking + audit trail", "agentic_equivalent": "every gram logged on the asset node; audit report compiles in one click", "notes": "Compliance is the moat — kernel-enforced logging beats spreadsheet memory", "retained": true}, {"canonical_function": "AI dispatch (Ai:den / ServiceTitan Dispatch Pro)", "agentic_equivalent": "agent dispatches by skill + cert + location + parts-on-van", "notes": "Match the incumbent capability, then add cert-gating they lack", "retained": true}, {"canonical_function": "defect → sales opportunity (service-to-sales)", "agentic_equivalent": "defects found on PPM become quoted opportunities automatically", "notes": "Every maintenance visit is a revenue event — model it", "retained": true}, {"canonical_function": "engineer cert gating (F-Gas, Gas Safe, NICEIC)", "agentic_equivalent": "agent refuses to dispatch uncertified engineers; chases renewals before expiry", "notes": "Same pattern as tradie certs, extended to refrigerant + multi-site", "retained": true}, {"canonical_function": "multi-site asset control + SLA clocks", "agentic_equivalent": "parent-company → sites → assets hierarchy; SLA timers deterministic", "notes": "Commercial contracts live or die on SLA attainment reporting", "retained": true}], "canonical_stack": [{"category": "HVAC FSM (UK mid-market)", "does": "PPM, asset tracking, Ai:den scheduling, GPS included, ~£97/user/mo, 12-mo terms", "tool": "Commusoft", "verdict": "import-from"}, {"category": "HVAC FSM (compliance-led)", "does": "PPM + bespoke certificate engine (Clik), asset registers, ~£45/user/mo — pick when certificates are the spine", "tool": "Joblogic", "verdict": "import-from"}, {"category": "HVAC FSM (small)", "does": "Scheduling + F-Gas certificates + invoicing; £29/field worker, office admins free", "tool": "iTrade", "verdict": "import-from"}, {"category": "FSM (fleet-heavy)", "does": "Vehicle tracking native, 15-100 vehicles — but 3-5 year lock-ins; read the contract thrice", "tool": "BigChange", "verdict": "import-from"}, {"category": "FSM (commercial/multi-trade)", "does": "Project phases, job costing per trade — the commercial fit-out pick", "tool": "simPRO", "verdict": "import-from"}, {"category": "FSM (enterprise)", "does": "Most powerful dispatch/analytics at £200-500/tech/mo — only for £5M+ revenue; irrelevant to SMB onboarding", "tool": "ServiceTitan", "verdict": "import-from"}, {"category": "accounting + tax", "does": "MTD, CIS, reverse-charge live here", "tool": "Xero / Sage", "verdict": "integrate"}], "countries": ["GB"], "entry_question": "Breakdown-led, PPM-led, or install-led HVAC firm — and what certs do your engineers hold?", "extra_dag_steps": [{"action": "data.import", "depends_on": ["email_verify"], "estimated_minutes": 15, "human_instructions": "Export clients, sites, assets, contracts; agent imports", "name": "Import clients + sites + assets", "resource": "{company_id}/assets", "step_id": "hvac_import", "step_type": "h_task"}, {"action": "certs.configure", "depends_on": ["hvac_import"], "estimated_minutes": 10, "human_instructions": "Confirm engineer cert register (F-Gas, Gas Safe) + expiry dates", "name": "Set engineer cert register", "resource": "{company_id}/certs", "step_id": "hvac_certs", "step_type": "h_task"}, {"action": "ppm.configure", "depends_on": ["hvac_certs"], "estimated_minutes": 10, "human_instructions": "Confirm PPM contract terms + visit frequencies", "name": "Configure PPM contracts", "resource": "{company_id}/contracts", "step_id": "hvac_ppm", "step_type": "h_task"}], "graph_shape": {"edges": [{"description": "site belongs to client", "from": "site", "relation": "of", "to": "client"}, {"description": "asset installed at site", "from": "asset", "relation": "at", "to": "site"}, {"description": "contract covers site", "from": "ppm_contract", "relation": "covers", "to": "site"}, {"description": "contract schedules visits", "from": "ppm_contract", "relation": "schedules", "to": "job"}, {"description": "job services asset", "from": "job", "relation": "services", "to": "asset"}, {"description": "refrigerant used on asset", "from": "refrigerant_log", "relation": "on", "to": "asset"}, {"description": "engineer certified", "from": "engineer", "relation": "holds", "to": "certificate"}, {"description": "job needs cert", "from": "job", "relation": "requires", "to": "certificate"}, {"description": "job billed", "from": "job", "relation": "billed_by", "to": "invoice"}], "nodes": [{"description": "HVAC/refrigeration unit with refrigerant history", "entity_type": "asset", "fields": ["site_id", "type", "make", "model", "serial", "refrigerant_type"]}, {"description": "Client site (branch of parent company)", "entity_type": "site", "fields": ["client_id", "address", "access_notes", "sla_tier"]}, {"description": "Client (parent company supported)", "entity_type": "client", "fields": ["name", "contract_ids", "contacts"]}, {"description": "Planned maintenance agreement", "entity_type": "ppm_contract", "fields": ["client_id", "visit_frequency", "assets_covered", "annual_value"]}, {"description": "Service/breakdown/install job", "entity_type": "job", "fields": ["asset_id", "site_id", "job_type", "status", "engineer_id"]}, {"description": "F-Gas handling record (audit-critical)", "entity_type": "refrigerant_log", "fields": ["asset_id", "job_id", "gas_type", "grams", "engineer_id", "timestamp"]}, {"description": "Engineer + cert register", "entity_type": "engineer", "fields": ["name", "cert_ids", "van_stock", "skills"]}, {"description": "F-Gas / Gas Safe / NICEIC cert", "entity_type": "certificate", "fields": ["type", "holder_id", "issued_at", "expires_at"]}, {"description": "Bill with VAT/CIS", "entity_type": "invoice", "fields": ["job_id", "total", "vat", "status"]}]}, "import_sources": ["Commusoft/Joblogic asset + contract export", "simPRO project export", "F-Gas logbooks (paper → digitise)"], "template_id": "tpl-hvac-gb", "vertical": "hvac", "workflows": [{"name": "breakdown → diagnose → quote → fix → certify", "steps": ["fault reported with asset id", "cert-gated engineer dispatched with van stock", "diagnosis + quote from price book", "fix + refrigerant logged per gram", "invoice + cert attached"], "trigger": "breakdown call"}, {"name": "PPM round → service → defect → upsell", "steps": ["contract auto-schedules visit", "engineer services per checklist", "defects logged as opportunities", "quote auto-drafted", "client approves → job created"], "trigger": "PPM due"}, {"name": "F-Gas audit compile", "steps": ["pull all refrigerant logs per asset", "reconcile against stock", "compile audit pack", "flag anomalies"], "trigger": "audit or quarterly review"}]}