{"agentic_mapping": [{"canonical_function": "channel mix (Booking.com 15-18% / Expedia / Airbnb)", "agentic_equivalent": "agent tracks TRUE net per channel per booking and steers repeats direct", "notes": "Verified 2026: Brighton boutique at £120k OTA volume pays £21.6k commission. 20% shift to direct saves £4k+/yr. Same math as restaurant delivery, bigger numbers.", "retained": true}, {"canonical_function": "rate parity (post-BGH Sep 2024 / DMA)", "agentic_equivalent": "direct rates legally undercut OTAs UK-wide — agent prices direct lower by policy", "notes": "Parity clauses are dead. The direct-booking engine is now a margin weapon, not a nice-to-have.", "retained": true}, {"canonical_function": "revenue management (occupancy/ADR/RevPAR)", "agentic_equivalent": "agent reprices by pace, events, day-of-week from booking nodes", "notes": "Rooms are the purest perishable inventory — unsold night = £0 forever. Price like it.", "retained": true}, {"canonical_function": "housekeeping turnover board", "agentic_equivalent": "departures generate timed tasks; room status gates check-in", "notes": "Same constraint board as garage bays — rooms are bays you sleep in", "retained": true}, {"canonical_function": "guest messaging pre/during/post stay", "agentic_equivalent": "upsell (late checkout, breakfast) + issue resolution in-thread", "notes": "Pre-arrival message is the review insurance — problems caught before checkout never reach Google", "retained": true}, {"canonical_function": "reviews (Google/Booking.com)", "agentic_equivalent": "agent asks post-checkout, responds from stay context", "notes": "Shared subroutine, timing-gated", "retained": true}], "canonical_stack": [{"category": "PMS (open API)", "does": "15k+ props, 1,000+ integrations, Booking Engine + Payments + POS; EU-built", "tool": "Mews", "verdict": "import-from"}, {"category": "PMS (unified)", "does": "PMS + channel manager + payments + Pricing Intelligence in one", "tool": "Cloudbeds", "verdict": "import-from"}, {"category": "PMS (UK champion)", "does": "30+ yrs UK deployment, Access Group ecosystem, GBP-native", "tool": "Guestline", "verdict": "import-from"}, {"category": "PMS (micro <20 rooms)", "does": "SiteMinder-bundled; the B&B/guesthouse default", "tool": "Little Hotelier", "verdict": "import-from"}, {"category": "PMS (UK small, MTD)", "does": "£32/mo with channel manager + MTD; free ≤5 rooms — best UK small-property value", "tool": "Frontdesko", "verdict": "import-from"}, {"category": "PMS (B&B/small)", "does": "GBP/EUR pricing for small hotels", "tool": "RoomRaccoon", "verdict": "import-from"}, {"category": "channel manager", "does": "53k+ props distribution network; now natively inside Mews (May 2026 partnership)", "tool": "SiteMinder", "verdict": "integrate"}, {"category": "OTA (dominant UK)", "does": "15-18% commission; parity dead — undercut direct legally", "tool": "Booking.com", "verdict": "integrate"}, {"category": "OTA (global)", "does": "Corporate + leisure volume", "tool": "Expedia", "verdict": "integrate"}, {"category": "OTA (alternative stay)", "does": "Apartments/serviced overlap", "tool": "Airbnb", "verdict": "integrate"}, {"category": "accounting + tax", "does": "MTD VAT on accommodation (20% standard / 0% where qualifying); revenue feed", "tool": "Xero", "verdict": "integrate"}], "countries": ["GB"], "entry_question": "Independent hotel, B&B/guesthouse, or serviced apartments — and what share of bookings is OTA vs direct today?", "extra_dag_steps": [{"action": "data.import", "depends_on": ["email_verify"], "estimated_minutes": 15, "human_instructions": "Export rooms, rate plans, forward bookings; agent imports", "name": "Import rooms + rates + bookings", "resource": "{company_id}/rooms", "step_id": "hotel_import", "step_type": "h_task"}, {"action": "channels.connect", "depends_on": ["hotel_import"], "estimated_minutes": 15, "human_instructions": "Connect channel manager + OTA listings; confirm commission per channel", "name": "Connect channels + OTAs", "resource": "{company_id}/channels", "step_id": "hotel_channels", "step_type": "h_task"}, {"action": "direct.configure", "depends_on": ["hotel_channels"], "estimated_minutes": 10, "human_instructions": "Set direct-booking undercut vs OTA + perks (breakfast/late checkout)", "name": "Configure direct-booking edge", "resource": "{company_id}/policy/direct", "step_id": "hotel_direct", "step_type": "h_task"}], "graph_shape": {"edges": [{"description": "guest holds reservation", "from": "guest", "relation": "holds", "to": "reservation"}, {"description": "reservation occupies room-night", "from": "reservation", "relation": "occupies", "to": "room"}, {"description": "reservation via channel", "from": "reservation", "relation": "via", "to": "channel"}, {"description": "reservation on rate plan", "from": "reservation", "relation": "on", "to": "rate_plan"}, {"description": "stay generates housekeeping", "from": "reservation", "relation": "needs", "to": "housekeeping_task"}, {"description": "stay billed", "from": "reservation", "relation": "billed_by", "to": "folio"}, {"description": "guest reviews stay", "from": "guest", "relation": "reviews", "to": "room"}], "nodes": [{"description": "Physical room / unit", "entity_type": "room", "fields": ["label", "type", "capacity", "status"]}, {"description": "Sellable rate (BAR, advance, OTA-markup)", "entity_type": "rate_plan", "fields": ["name", "base_price", "cancel_terms", "ota_markup"]}, {"description": "Booked stay", "entity_type": "reservation", "fields": ["guest_id", "room_id", "check_in", "check_out", "channel", "net", "status"]}, {"description": "Guest with stay history", "entity_type": "guest", "fields": ["name", "email", "prefs", "stays", "direct"]}, {"description": "Booking channel with true take", "entity_type": "channel", "fields": ["platform", "commission_pct", "effective_pct"]}, {"description": "Turnover/clean task", "entity_type": "housekeeping_task", "fields": ["room_id", "due_by", "status"]}, {"description": "Guest bill", "entity_type": "folio", "fields": ["reservation_id", "room_revenue", "extras", "vat", "status"]}]}, "import_sources": ["PMS export (rooms, rates, forward bookings)", "OTA extranet calendars", "Guest history CSV"], "template_id": "tpl-hotel-gb", "vertical": "hotel", "workflows": [{"name": "book → pre-arrival → check-in → stay → checkout → review", "steps": ["booking lands with channel + net", "pre-arrival message + upsell", "check-in with prefs surfaced", "in-stay issues caught in-thread", "checkout + folio", "review ask"], "trigger": "reservation"}, {"name": "direct recovery", "steps": ["OTA guest flagged post-stay", "direct incentive offered (rate + perk)", "next booking direct tracked", "mix % reported weekly"], "trigger": "OTA checkout"}, {"name": "turnover guard", "steps": ["departures generate timed tasks", "room status gates new check-ins", "late checkout sold where gaps allow"], "trigger": "departure day"}]}