{"agentic_mapping": [{"canonical_function": "job cards + bay allocation", "agentic_equivalent": "agent creates job card from booking/call, allocates bay + tech by skill", "notes": "Bay is the garage's chair — same constraint solve as barber/beauty", "retained": true}, {"canonical_function": "vehicle inspection / DVI with photos", "agentic_equivalent": "tech captures photos/video; agent assembles customer-facing report", "notes": "DVI is the trust engine — keep it, make it instant", "retained": true}, {"canonical_function": "estimate + customer approval", "agentic_equivalent": "agent sends estimate with photos; work starts only on explicit approval", "notes": "Approval-gated spend, same pattern as domain purchase — kernel-native", "retained": true}, {"canonical_function": "parts ordering (TecDoc/Autodata lookup)", "agentic_equivalent": "agent looks up parts, checks stock, orders on approval; stock decrements", "notes": "Parts margin tracked per job card", "retained": true}, {"canonical_function": "MOT/DVLA management + reminders", "agentic_equivalent": "DVLA integration kept; agent sends MOT-due reminders + books slots", "notes": "DVLA cannot be replaced — verdict is integrate, forever", "retained": true}, {"canonical_function": "invoicing + VAT", "agentic_equivalent": "invoice on collection; VAT-aware; payment link", "notes": "Same taxes-lite pattern as trades", "retained": true}], "canonical_stack": [{"category": "garage management (UK)", "does": "Diarised jobs, TecDoc/Autodata parts, MS Business Central sync; proven at 5+ staff", "tool": "Garage Hive", "verdict": "import-from"}, {"category": "garage management (UK)", "does": "MOT, DVLA, parts, invoicing; 14,500+ UK users, mature ecosystem", "tool": "TechMan", "verdict": "import-from"}, {"category": "garage management", "does": "Real-time multi-bay allocation for 3+ bay shops", "tool": "Dragon2000", "verdict": "import-from"}, {"category": "MOT management", "does": "Lightweight DVLA reminders for MOT-heavy centres", "tool": "MOT Manager", "verdict": "integrate"}, {"category": "garage CRM (UK)", "does": "Jobs, MOT, CRM, AI receptionist + fault-finder bundled", "tool": "My Garage CRM", "verdict": "import-from"}, {"category": "inspections (US)", "does": "Best-in-class DVI UX; no UK MOT/DVLA", "tool": "Tekmetric", "verdict": "import-from"}, {"category": "government", "does": "MOT history, recalls, vehicle data — irreplaceable", "tool": "DVLA/DVSA APIs", "verdict": "integrate"}, {"category": "messaging-first workshop", "does": "WhatsApp-first comms for sub-10-staff shops — closest incumbent to agentic positioning; watch, don't dismiss", "tool": "Carsu", "verdict": "import-from"}, {"category": "MOT centres", "does": "MOT plus basic job cards for MOT-heavy sites", "tool": "BookMOT", "verdict": "import-from"}, {"category": "existing data", "does": "Customers, vehicles, job history, parts stock", "tool": "Garage Hive/TechMan export", "verdict": "import-from"}], "countries": ["GB"], "entry_question": "Fresh workshop or existing garage with customers + vehicles + stock to import?", "extra_dag_steps": [{"action": "data.import", "depends_on": ["email_verify"], "estimated_minutes": 15, "human_instructions": "Export customers, vehicles, stock; agent imports to nodes", "name": "Import customers + vehicles + stock", "resource": "{company_id}/vehicles", "step_id": "garage_import", "step_type": "h_task"}, {"action": "rates.configure", "depends_on": ["garage_import"], "estimated_minutes": 10, "human_instructions": "Confirm labour rate, MOT price, bay count, tech roster", "name": "Set labour rate + bays + techs", "resource": "{company_id}/workshop", "step_id": "garage_rates", "step_type": "h_task"}, {"action": "dvla.connect", "depends_on": ["garage_rates"], "estimated_minutes": 5, "human_instructions": "Connect DVLA API credentials", "name": "Connect DVLA/MOT", "resource": "{company_id}/integrations/dvla", "step_id": "garage_dvla", "step_type": "h_task"}], "graph_shape": {"edges": [{"description": "customer owns vehicle", "from": "customer", "relation": "owns", "to": "vehicle"}, {"description": "vehicle booked in", "from": "vehicle", "relation": "booked_for", "to": "job_card"}, {"description": "job allocated to bay", "from": "job_card", "relation": "in", "to": "bay"}, {"description": "tech works the job", "from": "technician", "relation": "works", "to": "job_card"}, {"description": "inspection finds work", "from": "inspection", "relation": "finds", "to": "job_line"}, {"description": "job consumes parts", "from": "job_line", "relation": "uses", "to": "part"}, {"description": "MOT record on vehicle", "from": "mot_record", "relation": "on", "to": "vehicle"}, {"description": "job billed", "from": "job_card", "relation": "billed_by", "to": "invoice"}], "nodes": [{"description": "Vehicle by reg/VIN", "entity_type": "vehicle", "fields": ["reg", "vin", "make", "model", "year", "mileage", "mot_due"]}, {"description": "Customer", "entity_type": "customer", "fields": ["name", "phone", "email"]}, {"description": "One workshop visit", "entity_type": "job_card", "fields": ["vehicle_reg", "customer_id", "bay_id", "tech_id", "status", "promised_at"]}, {"description": "Single line of work", "entity_type": "job_line", "fields": ["job_card_id", "description", "labour_min", "status", "approved"]}, {"description": "Physical bay", "entity_type": "bay", "fields": ["name", "equipment", "status"]}, {"description": "Technician + skills", "entity_type": "technician", "fields": ["name", "skills", "mot_tester"]}, {"description": "DVI with photos", "entity_type": "inspection", "fields": ["job_card_id", "photos", "advisories", "sent_at"]}, {"description": "Stocked part", "entity_type": "part", "fields": ["sku", "name", "cost", "price", "qty_on_hand", "supplier_id"]}, {"description": "MOT test record", "entity_type": "mot_record", "fields": ["vehicle_reg", "tested_at", "result", "expiry", "advisories"]}, {"description": "Bill with VAT", "entity_type": "invoice", "fields": ["job_card_id", "total", "vat", "status"]}]}, "import_sources": ["Garage Hive export", "TechMan export", "Dragon2000 export", "MOT history (DVLA)"], "template_id": "tpl-garage-gb", "vertical": "garage", "workflows": [{"name": "book → check-in → inspect → approve → work → collect", "steps": ["booking or call creates job card", "check-in captures mileage + fuel + damage photos", "tech inspects, DVI with photos sent", "estimate approved by customer (gated)", "work done, QC check", "invoice + VAT, payment on collection", "MOT reminder scheduled"], "trigger": "booking or inbound call"}, {"name": "MOT due campaign", "steps": ["scan vehicles with MOT due < 30 days", "agent sends reminder + books slot", "track conversion"], "trigger": "weekly MOT-due scan"}, {"name": "parts margin guard", "steps": ["parts looked up with cost + price", "margin checked against floor", "stock decremented on fit", "reorder flagged at minimum"], "trigger": "job line needs part"}]}